{
  "schemaVersion": 1,
  "id": "lei-8112-inicial",
  "name": "Lei nº 8.112/1990",
  "description": "10 questões autorais para começar. Regime jurídico federal, provimento, posse e vacância. Conferidas no texto compilado do Planalto em 08/10/2026.",
  "questions": [
    {"id":"8112-001","discipline":"Legislação","subject":"Regime jurídico federal","topic":"Abrangência","statement":"A Lei nº 8.112/1990 institui o regime jurídico dos servidores públicos civis de qual conjunto de entidades?","options":[{"id":"A","text":"União, autarquias federais, inclusive as de regime especial, e fundações públicas federais."},{"id":"B","text":"Exclusivamente os órgãos da administração direta da União."},{"id":"C","text":"União e todas as empresas públicas e sociedades de economia mista."},{"id":"D","text":"Todos os órgãos e entidades federais, estaduais e municipais, obrigatoriamente."}],"correctOption":"A","explanation":"O regime previsto alcança a União, suas autarquias e suas fundações públicas. Autarquias de regime especial também estão incluídas. A lei não impõe esse regime a estados e municípios nem inclui indistintamente empresas estatais. Essa delimitação ajuda a identificar a aplicação do regime federal.","reference":{"label":"Lei nº 8.112/1990, art. 1º","url":"https://www.planalto.gov.br/ccivil_03/leis/l8112compilado.htm"},"difficulty":"easy","tags":["regime jurídico","abrangência"]},
    {"id":"8112-002","discipline":"Legislação","subject":"Provimento","topic":"Investidura","statement":"Em qual momento ocorre a investidura do servidor em cargo público, conforme a Lei nº 8.112/1990?","options":[{"id":"A","text":"Na aprovação no concurso."},{"id":"B","text":"Na publicação do resultado final do concurso."},{"id":"C","text":"Na posse."},{"id":"D","text":"No primeiro dia de exercício."}],"correctOption":"C","explanation":"A investidura acontece na posse. Aprovação e nomeação são etapas anteriores; exercício é o desempenho efetivo das atribuições após a posse. Ao resolver questões, diferencie essas etapas: aprovação, nomeação, posse e exercício.","reference":{"label":"Lei nº 8.112/1990, art. 7º","url":"https://www.planalto.gov.br/ccivil_03/leis/l8112compilado.htm"},"difficulty":"easy","tags":["posse","investidura"]},
    {"id":"8112-003","discipline":"Legislação","subject":"Provimento","topic":"Formas de provimento","statement":"Qual alternativa apresenta uma forma de provimento atualmente prevista no art. 8º da Lei nº 8.112/1990?","options":[{"id":"A","text":"Ascensão."},{"id":"B","text":"Transferência."},{"id":"C","text":"Remoção."},{"id":"D","text":"Aproveitamento."}],"correctOption":"D","explanation":"Aproveitamento integra as formas de provimento. Ascensão e transferência deixaram de compor esse rol após revogação. Remoção é deslocamento dentro do mesmo quadro e não constitui forma de provimento. Para memorizar o rol vigente, associe cada instituto à situação funcional que ele resolve.","reference":{"label":"Lei nº 8.112/1990, art. 8º, VII, e art. 36","url":"https://www.planalto.gov.br/ccivil_03/leis/l8112compilado.htm"},"difficulty":"medium","tags":["provimento","aproveitamento","revogação"]},
    {"id":"8112-004","discipline":"Legislação","subject":"Concurso público","topic":"Prazo de validade","statement":"Segundo o art. 12 da Lei nº 8.112/1990, qual é a regra para a validade de um concurso público?","options":[{"id":"A","text":"Exatamente dois anos, com prorrogações ilimitadas."},{"id":"B","text":"Até dois anos, com uma única prorrogação por igual período."},{"id":"C","text":"Até quatro anos, sem qualquer prorrogação."},{"id":"D","text":"Um ano, obrigatoriamente, prorrogável por dois anos."}],"correctOption":"B","explanation":"O prazo inicial pode ser de até dois anos. Há possibilidade de uma única prorrogação, de duração igual ao prazo inicialmente fixado. Por exemplo, um concurso válido por um ano pode ser prorrogado uma vez por mais um ano; não se transforma automaticamente em uma prorrogação de dois anos.","reference":{"label":"Lei nº 8.112/1990, art. 12","url":"https://www.planalto.gov.br/ccivil_03/leis/l8112compilado.htm"},"difficulty":"easy","tags":["concurso","validade","prazos"]},
    {"id":"8112-005","discipline":"Legislação","subject":"Posse e exercício","topic":"Prazo para posse","statement":"Na regra geral, sem impedimentos legais que alterem a contagem, qual é o prazo para a posse contado da publicação do ato de provimento?","options":[{"id":"A","text":"30 dias."},{"id":"B","text":"15 dias."},{"id":"C","text":"10 dias."},{"id":"D","text":"60 dias."}],"correctOption":"A","explanation":"A regra geral é de trinta dias para tomar posse, contados da publicação do ato de provimento. O prazo de quinze dias diz respeito ao início do exercício após a posse. A lei prevê situações específicas de impedimento que alteram o termo inicial, mas elas não fazem parte deste enunciado.","reference":{"label":"Lei nº 8.112/1990, art. 13, §§ 1º e 2º","url":"https://www.planalto.gov.br/ccivil_03/leis/l8112compilado.htm"},"difficulty":"easy","tags":["posse","prazos"]},
    {"id":"8112-006","discipline":"Legislação","subject":"Posse e exercício","topic":"Prazo para exercício","statement":"Qual é o prazo geral para um servidor empossado em cargo público entrar em exercício, contado da data da posse?","options":[{"id":"A","text":"5 dias."},{"id":"B","text":"10 dias."},{"id":"C","text":"15 dias."},{"id":"D","text":"30 dias."}],"correctOption":"C","explanation":"Após a posse, o servidor dispõe de quinze dias para iniciar o exercício. Exercício corresponde ao efetivo desempenho das atribuições. Se o servidor já tomou posse e não entra em exercício no prazo legal, a consequência prevista é a exoneração; isso difere de não tomar posse, situação em que o ato de provimento fica sem efeito.","reference":{"label":"Lei nº 8.112/1990, art. 15, §§ 1º e 2º; art. 13, § 6º","url":"https://www.planalto.gov.br/ccivil_03/leis/l8112compilado.htm"},"difficulty":"medium","tags":["exercício","prazos","exoneração"]},
    {"id":"8112-007","discipline":"Legislação","subject":"Provimento","topic":"Readaptação","statement":"Um servidor sofre limitação física ou mental, comprovada em inspeção médica, e passa a ocupar cargo com atribuições compatíveis com essa limitação. Qual instituto descreve essa situação?","options":[{"id":"A","text":"Reintegração."},{"id":"B","text":"Readaptação."},{"id":"C","text":"Recondução."},{"id":"D","text":"Redistribuição."}],"correctOption":"B","explanation":"Readaptação atende à limitação verificada em inspeção médica, mediante atribuições compatíveis. Ela deve observar habilitação, escolaridade e equivalência de vencimentos, conforme a lei. Reintegração se relaciona à invalidação de demissão; recondução é retorno ao cargo anterior nas hipóteses legais.","reference":{"label":"Lei nº 8.112/1990, art. 24","url":"https://www.planalto.gov.br/ccivil_03/leis/l8112compilado.htm"},"difficulty":"medium","tags":["readaptação","provimento"]},
    {"id":"8112-008","discipline":"Legislação","subject":"Provimento","topic":"Reintegração","statement":"A demissão de um servidor estável é invalidada por decisão administrativa ou judicial. Seu retorno ao cargo anterior, ou ao resultante de transformação, com ressarcimento das vantagens, caracteriza:","options":[{"id":"A","text":"Reversão."},{"id":"B","text":"Aproveitamento."},{"id":"C","text":"Recondução."},{"id":"D","text":"Reintegração."}],"correctOption":"D","explanation":"A reintegração decorre da invalidação da demissão de servidor estável e inclui o ressarcimento das vantagens. Reversão diz respeito ao retorno de aposentado; aproveitamento, ao servidor em disponibilidade; recondução, ao retorno ao cargo anterior nas hipóteses próprias.","reference":{"label":"Lei nº 8.112/1990, art. 28","url":"https://www.planalto.gov.br/ccivil_03/leis/l8112compilado.htm"},"difficulty":"medium","tags":["reintegração","demissão","provimento"]},
    {"id":"8112-009","discipline":"Legislação","subject":"Provimento","topic":"Recondução","statement":"Um servidor estável não é aprovado no estágio probatório relativo a outro cargo. O retorno ao cargo anteriormente ocupado corresponde a qual forma de provimento?","options":[{"id":"A","text":"Recondução."},{"id":"B","text":"Reversão."},{"id":"C","text":"Readaptação."},{"id":"D","text":"Reintegração."}],"correctOption":"A","explanation":"Recondução é o retorno do servidor estável ao cargo anterior por inabilitação no estágio probatório de outro cargo ou pela reintegração do ocupante anterior. Atenção à condição de estabilidade e ao motivo do retorno: não se trata de invalidação da própria demissão, hipótese de reintegração.","reference":{"label":"Lei nº 8.112/1990, art. 29, I e II","url":"https://www.planalto.gov.br/ccivil_03/leis/l8112compilado.htm"},"difficulty":"medium","tags":["recondução","estágio probatório","provimento"]},
    {"id":"8112-010","discipline":"Legislação","subject":"Vacância","topic":"Hipóteses de vacância","statement":"Qual situação constitui hipótese de vacância expressamente prevista no art. 33 da Lei nº 8.112/1990?","options":[{"id":"A","text":"Remoção do servidor para outra unidade do mesmo quadro."},{"id":"B","text":"Concessão de licença para capacitação."},{"id":"C","text":"Posse em outro cargo inacumulável."},{"id":"D","text":"Designação temporária para substituir uma chefia."}],"correctOption":"C","explanation":"A posse em outro cargo inacumulável é hipótese legal de vacância. Remoção, licença e substituição não constam desse rol. A vacância também pode decorrer de exoneração, demissão, promoção, readaptação, aposentadoria ou falecimento. Observe que promoção e readaptação aparecem tanto no provimento quanto na vacância.","reference":{"label":"Lei nº 8.112/1990, art. 33, VIII","url":"https://www.planalto.gov.br/ccivil_03/leis/l8112compilado.htm"},"difficulty":"medium","tags":["vacância","acumulação","posse"]}
  ]
}
